[
  {"plantSlug":"tulasi","target":"usefulParts","sourceId":"echarak-medicinal-plants-list","verification":"reviewed","locator":"List of Medicinal Plants: Ocimum sanctum — Leaf; Tulsi Panchang — Whole Plant","notes":"Current e-Charak medicinal-plant listing uses Ocimum sanctum for Tulsi and separately lists Tulsi Panchang as whole plant. Do not silently equate this with the current accepted botanical name without identity review."},
  {"plantSlug":"ashwagandha","target":"usefulParts","sourceId":"echarak-medicinal-plants-list","verification":"reviewed","locator":"List of Medicinal Plants: Withania somnifera — Root","notes":"Official Ministry of Ayush e-Charak listing identifies root as the listed part."},
  {"plantSlug":"guduchi","target":"usefulParts","sourceId":"echarak-medicinal-plants-list","verification":"reviewed","locator":"List of Medicinal Plants: Tinospora cordifolia — Stem","notes":"Official Ministry of Ayush e-Charak listing identifies stem as the listed part."},
  {"plantSlug":"amalaki","target":"usefulParts","sourceId":"echarak-medicinal-plants-list","verification":"reviewed","locator":"List of Medicinal Plants: Emblica officinalis — Fruit","notes":"Official listing uses Emblica officinalis and identifies fruit; botanical-name normalization should remain separately documented."},
  {"plantSlug":"haritaki","target":"usefulParts","sourceId":"echarak-medicinal-plants-list","verification":"reviewed","locator":"List of Medicinal Plants: Terminalia chebula — Fruit","notes":"Official Ministry of Ayush e-Charak listing identifies fruit."},
  {"plantSlug":"nimba","target":"usefulParts","sourceId":"echarak-medicinal-plants-list","verification":"reviewed","locator":"List of Medicinal Plants: Azadirachta indica — Seed and Leaf","notes":"Official listing contains both seed (Nimboli) and leaf (Neem); preserve part-specific records."},
  {"plantSlug":"shatavari","target":"usefulParts","sourceId":"echarak-medicinal-plants-list","verification":"reviewed","locator":"List of Medicinal Plants: Asparagus racemosus — Root","notes":"Official listing identifies root for listed regional entries."},
  {"plantSlug":"brahmi","target":"usefulParts","sourceId":"echarak-medicinal-plants-list","verification":"reviewed","locator":"List of Medicinal Plants: Bacopa monnieri — Whole Plant","notes":"Official Ministry of Ayush e-Charak listing identifies whole plant."},
  {"plantSlug":"arjuna","target":"usefulParts","sourceId":"echarak-medicinal-plants-list","verification":"reviewed","locator":"List of Medicinal Plants: Terminalia arjuna — Bark","notes":"Official Ministry of Ayush e-Charak listing identifies bark."},
  {"plantSlug":"ashoka","target":"usefulParts","sourceId":"echarak-medicinal-plants-list","verification":"reviewed","locator":"List of Medicinal Plants: Saraca asoca — Bark","notes":"Official Ministry of Ayush e-Charak listing identifies bark."},
  {"plantSlug":"yashtimadhu","target":"usefulParts","sourceId":"echarak-medicinal-plants-list","verification":"reviewed","locator":"List of Medicinal Plants: Glycyrrhiza glabra — Root","notes":"Official Ministry of Ayush e-Charak listing identifies root."},
  {"plantSlug":"pippali","target":"usefulParts","sourceId":"echarak-medicinal-plants-list","verification":"reviewed","locator":"List of Medicinal Plants: Piper longum — Fruit","notes":"Official listing identifies fruit, including regional/imported entries."},
  {"plantSlug":"shunthi","target":"usefulParts","sourceId":"ayurvedic-pharmacopoeia-source-framework","verification":"reviewed","locator":"Evidence target requires API/official monograph lookup before verification","notes":"No useful-part claim promoted from a secondary source in this pass."},
  {"plantSlug":"maricha","target":"usefulParts","sourceId":"ayurvedic-pharmacopoeia-source-framework","verification":"reviewed","locator":"Evidence target requires API/official monograph lookup before verification","notes":"No useful-part claim promoted from a secondary source in this pass."}
]