[
  {"plantSlug":"tulasi","target":"dravyaguna","sourceId":"src-tulasi-carak","claim":"Rasa: katu, tikta","kind":"classical","locator":"Surasa herb database — Ayurvedic pharmacological properties","verification":"reviewed","notes":"Secondary digital herb database reports these properties; exact primary-text verse/edition locator still required before verification."},
  {"plantSlug":"tulasi","target":"dravyaguna","sourceId":"src-tulasi-carak","claim":"Guna: laghu, ruksha","kind":"classical","locator":"Surasa herb database — Ayurvedic pharmacological properties","verification":"reviewed","notes":"Exact primary-text verse/edition locator still required before verification."},
  {"plantSlug":"tulasi","target":"dravyaguna","sourceId":"src-tulasi-carak","claim":"Virya: ushna","kind":"classical","locator":"Surasa herb database — Ayurvedic pharmacological properties","verification":"reviewed","notes":"Exact primary-text verse/edition locator still required before verification."},
  {"plantSlug":"tulasi","target":"dravyaguna","sourceId":"src-tulasi-carak","claim":"Vipaka: katu","kind":"classical","locator":"Surasa herb database — Ayurvedic pharmacological properties","verification":"reviewed","notes":"Exact primary-text verse/edition locator still required before verification."},
  {"plantSlug":"tulasi","target":"dravyaguna","sourceId":"src-tulasi-carak","claim":"Karma: kapha-vata pacifying; krimighna is reported as prabhava","kind":"classical","locator":"Surasa herb database — Ayurvedic pharmacological properties","verification":"reviewed","notes":"Preserved as a reported secondary-source claim; not promoted to verified."},
  {"plantSlug":"tulasi","target":"therapeuticUses","sourceId":"src-tulasi-carak","claim":"Traditional indications reported include aruchi, shwasa, kasa, krumiroga, kushtha, pratishyaya and parshwashoola","kind":"classical","locator":"Surasa herb database — Therapeutic uses","verification":"reviewed","notes":"Exact primary-text citations should be added before verification."}
]